Quote,Author,Born,Died,Description,Date Spoken,Source(s),Topic,Comments
"I didn't know what a billion was. I don't think most of those men downtown know what a billion is, either. And if you don't know what a billion is, how on earth do you know what a billionth is?",Grace Hopper,1906,1992,American computer scientist who invented one of the first compiler related tools and whose work led to the development of COBOL.,Unknown,http://www.quotabelle.com/discover,"billion, knowledge",
"The application of systems techniques has been successful in scientific and technical applications . . . It meets difficulty when it is applied in social and political situations largely because people are not 'well-behaved' mathematical functions, but can only be represented by statistical approximations, and all of the extremes can and do occur.",Grace Hopper,1906,1992,American computer scientist who invented one of the first compiler related tools and whose work led to the development of COBOL.,Unknown,http://www.quotabelle.com/discover,"systems, technology, social, situations, statistics",
People are not 'well-behaved' mathematical functions.,Grace Hopper,1906,1992,American computer scientist who invented one of the first compiler related tools and whose work led to the development of COBOL.,Unknown,http://www.quotabelle.com/discover,"mathematics, functions, people",
"...For me, at the end of the day, the success of a business is not gender-driven. The question is: do you have the right background and the right team?",Jenny Lee,1972,-,One of the most respected and valuable tech investors in China right now.,2015,https://www.forbes.com/sites/ryanmac/2015/03/25/jenny-lee-midas-list-top-ranked-woman-interview-china/#2a094d552d88,"gender, background, team, business, success",
...the question to answer is how do we get more women in the industry? That starts with education whether that’s in high school or college. ...We need to get more women to start early in these areas.,Jenny Lee,1972,-,One of the most respected and valuable tech investors in China right now.,2015,https://www.forbes.com/sites/ryanmac/2015/03/25/jenny-lee-midas-list-top-ranked-woman-interview-china/#2a094d552d88,"women, industry, education",
"It takes humility to realize we don't know everything, not to rest on our laurels, and to know that we must keep learning and observing. If we don't, we can be sure some startup will be there to take our place.",Cher Wang,1958,-,Taiwanese entrepreneur and philanthropist who cofounded HTC and VIA Technologies.,Unknown,http://www.myfrugalbusiness.com/2016/12/cher-wang-entrepreneur-quotes.html,"humility, knowledge, learn",
"If you have a vision, no matter how difficult things are, everything just becomes a process.",Cher Wang,1958,-,Taiwanese entrepreneur and philanthropist who cofounded HTC and VIA Technologies.,Unknown,http://www.myfrugalbusiness.com/2016/12/cher-wang-entrepreneur-quotes.html,"vision, process, difficulty",
"I always have this imagination, something I want to use. I don't understand the idea of leisure time.",Cher Wang,1958,-,Taiwanese entrepreneur and philanthropist who cofounded HTC and VIA Technologies.,Unknown,http://www.myfrugalbusiness.com/2016/12/cher-wang-entrepreneur-quotes.html,"imagination, time",
Hundreds of ideas are tested and discarded to find the rare ideas that define the user experience.,Cher Wang,1958,-,Taiwanese entrepreneur and philanthropist who cofounded HTC and VIA Technologies.,Unknown,http://www.myfrugalbusiness.com/2016/12/cher-wang-entrepreneur-quotes.html,"ideas, rare, experience",
"As entrepreneurs, we must continue to ask ourselves What's Next?",Cher Wang,1958,-,Taiwanese entrepreneur and philanthropist who cofounded HTC and VIA Technologies.,Unknown,http://www.myfrugalbusiness.com/2016/12/cher-wang-entrepreneur-quotes.html,"ask, next",
Whatever it is that you think you want to do - and whatever it is that you think stands between you and that - stop making excuses. You can do anything.,Katia Beauchamp,?,-,Founder and co-CEO of Birchbox.,Unknown,http://lifehacker.com/im-katia-beauchamp-birchbox-co-founder-and-ceo-and-th-1795889433,excuses,
"I’ve received a lot of great advice over the years, but most of what’s sticking with me right now is about creating your own reality and the idea of self-fulfilling prophecies. Staying in the game is such a huge part of winning the game—so many people tap out. I have learned a lot about building resilience and believing that you can handle whatever is thrown at you.",Katia Beauchamp,?,-,Founder and co-CEO of Birchbox.,2017,http://lifehacker.com/im-katia-beauchamp-birchbox-co-founder-and-ceo-and-th-1795889433,"advice, reality, prophecies, game, belief",
"...I realize society has a gendered view on how women change the world. When a woman says she is going to change the world, society expects that she is going to launch a nonprofit. My efforts are focused on women changing the world through for-profit social ventures.",Natalia Oberti Noguera,?,-,"Founder and CEO of Pipeline Angels, a network of women investors that is changing the face of angel investing and creating capital for women social entrepreneurs.",Unknown,http://www.sparkpluglabs.co/awesome-woman/nataliaobertinoguera,"society, gender, women, change",
What keeps me busy? Getting more voices in the room.,Natalia Oberti Noguera,?,-,"Founder and CEO of Pipeline Angels, a network of women investors that is changing the face of angel investing and creating capital for women social entrepreneurs.",Unknown,http://www.sparkpluglabs.co/awesome-woman/nataliaobertinoguera,"busy, voices",